title,mantra
Brihadaranyaka Upanishad,तस्य ह वा एतस्य हृदयस्य पञ्च देवसुषयः स योऽस्य प्राङ्सुषिः स प्राणस्तञ्चक्षुः स आदित्यस्तदेतत्तेजोऽन्नाद्यमित्युपासीत तेजस्व्यन्नादो भवति य एवं वेद ।। 3.13.1 ।। 
Brihadaranyaka Upanishad,अथ योऽस्य दक्षिणः सुषिः स व्यानस्तच्छ्रोत्रँ् स चन्द्रमास्तदेतच्छ्रीश्च यशश्चेत्युपासीत श्रीमान्यशस्वी भवति य एवं वेद ।। 3.13.2 ।। 
Brihadaranyaka Upanishad,अथ योऽस्य प्रत्यङ्सुषिः सो पानः सा वाक्सोऽग्रिस् देतद्ब्रह्मवर्चसमन्नाद्यमित्युपासीत ब्रह्मवर्चस्यन्नादो भवति य एवं वेद ।। 3.13.3 ।। 
Brihadaranyaka Upanishad,अथ योऽस्योदङ्सुषिः स समानस्तन्मनः स पर्जन्यस्तदेतत्कीर्तिश्च व्युष्टिश्चेत्युपासीत कीर्तिमान्व्युष्टिमान्भवति य एवं वेद ।। 3.13.4 ।। 
Brihadaranyaka Upanishad,अथ योऽस्योर्ध्वः सुषिः स उदानः स वायुः स आकाशस्तदेतदोजश्च महश्चेत्युपासीतौजस्वी महस्वान्भवति य एवं वेद ।। 3.13.5 ।। 
Brihadaranyaka Upanishad,ते वा एते पञ्च ब्रह्मपुरुषाः स्वर्गस्य लोकस्य द्वारपाः स य एतानेवं पञ्च ब्रह्मपुरुषान्स्वर्गस्य लोकस्य द्वारपान्वेदास्य कुले वीरो जायते प्रतिपद्यते स्वर्गं लोकं य एतानेवं पञ्च ब्रह्मपुरुषान्स्वर्गस्य लोकस्य द्वारपान्वेद ।। 3.13.6 ।। 
Brihadaranyaka Upanishad,अथ यदतः परो दिवो ज्योतिर्दीप्यते विश्वतः पृष्ठेषु सर्वतः पृष्ठेष्वनुत्तमेषूत्तमेषु लोकेष्विदं वाव तद्यदिदिमस्मिन्नन्तः पुरुषे ज्योति ।। 3.13.7 ।।
Brihadaranyaka Upanishad,"तस्यैषा दृष्टिर्यत्रैतदस्मित्र्छरीरे स , स्पर्शेनोष्णिमानं विजानाति तस्यैषा श्रुतिर्यत्रैतत्कर्णावपिगृह्य निनदमिव नदथुरिवाग्नेरिव ज्वलत उपश्रृणोति तदेतद्दृष्टं च श्रुतं चेत्युपासीत चक्षुष्यः श्रुतो भवति य एवं वेद य एवं वेद ।। 3.13.8 ।। इति त्रयोदशः खण्डः ।। 13 ।। "
Brihadaranyaka Upanishad,सर्वं खल्विदं ब्रह्म तज्जलानिति शान्त उपासीत ।  अथ खलु क्रतुमयः पुरुषो यथाक्रतुरस्मिँल्लोके पुरुषो भवति तथेतः प्रेत्य भवति स क्रतुं कुर्वीत ।। 3.14.1 ।।
Brihadaranyaka Upanishad,मनोमयः प्राणशरीरो भारूपः सत्यसङ्कल्प आकाशात्मा सर्वकर्मा सर्वकामः सर्वगन्धः सर्वरसः सर्वमिदमभ्यात्तोऽवाक्यनादरः ।। 3.14.2 ।। 
Brihadaranyaka Upanishad,एष म आत्मान्तर्हृदयेऽणीयान्व्रीहेर्वा यवाद्वा सर्षपाद्वा श्यामाकाद्वा श्यामाकतण्डुलाद्वैष म आत्मान्तर्हृदये ज्यायान्पृथिव्या ज्यायानन्तरिक्षाज्ज्यायान्दिवो ज्यायानेभ्यो लोकेभ्यः ।। 3.14.3 ।। 
Brihadaranyaka Upanishad,सर्वकर्मा सर्वकामः सर्वगन्धः सर्वरसः सर्वमिदमभ्यात्तोऽवाक्यनादर एष म आत्मान्तर्हृदय एतद्ब्रह्मैतमितः प्रेत्याभिसम्भवितास्मीति यस्य स्यादद्धा न विचिकित्सास्तीति ह स्माह शाण्डिल्यः शाण्डिल्यः ।। 3.14.4 ।। इति चतुर्दशः खण्डः ।। 13.14.4 ।।  
Brihadaranyaka Upanishad,अन्तरिक्षोदरः कोशो भूमिबुध्नो न जीर्यति ।दिशो ह्यस्य स्रक्तयो द्यौरस्योत्तरं बिलम् ।स एष कोशो वसुधानस्तस्मिन्विश्वमिदँ् श्रितम् ।। 3.15.1 ।। 
Brihadaranyaka Upanishad,तस्य प्राची दिग्जुहूर्नाम सहमानां नाम दक्षिणा राज्ञी नाम प्रतीची सुभूता नामोदीची तासां वायुर्वत्सः स य एतमेवं वायुं दिशां वत्सं वेद न पुत्ररोदँ् रोदिति सोऽहमेतमेवं वायुं दिशां वत्सं वेद मा पुत्ररोदँ् रुदम् ।। 3.15.2 ।। 
Brihadaranyaka Upanishad,अरिष्टं कोशं प्रपद्येऽमुनामुनामुना प्राणं प्रपद्येऽमुनामुनामुना भूः प्रपद्येऽमुनामुनामुना भुवः प्रपद्येऽमुनामुनामुना स्वः प्रपद्येऽमुनामुनामुना ।। 3.15.3 ।। 
Brihadaranyaka Upanishad,"स यदवोचं प्राणं प्रपद्य इति प्राणो वा इद , सर्वं भूतं यदिदं किञ्च तमेव तत्प्रापत्सि ।। 3.15.4 ।। "
Brihadaranyaka Upanishad,अथ यदवोचं भूः प्रपद्य इति पृथिवीं प्रपद्येऽन्तिरक्षं प्रपद्ये दिवं प्रपद्य इत्येव तदवोचम् ।। 3.15.5 ।। 
Brihadaranyaka Upanishad,अथ यदवोचं भुवः प्रपद्य इत्यग्निं प्रपद्ये वायुं प्रपद्य आदित्यं प्रपद्य इत्येव तदवोचम् ।। 3.15.6 ।। 
Brihadaranyaka Upanishad,अथ यदवोचँ् स्वः प्रपद्य इत्यृग्वेदं प्रपद्ये यजुर्वेदं प्रपद्ये सामवेदं प्रपद्य इत्येव तदवोचं तदवोचम् ।। 3.15.7 ।। इति पञ्चदशः खण्डः ।। 15 ।। 
Brihadaranyaka Upanishad,"पुरुषो वाव यज्ञस्तस्य यानि चतुर्वि , शतिवर्षाणि तत्प्रातःसवनं चतुर्वि , शत्यक्षरा गायत्री गायत्रं प्रातः सवनं तदस्य वसवोऽन्वायत्ताः प्राणा वाव वसव एते हीदँ् सर्वं वासयन्ति ।। 3.16.1 ।।"
Brihadaranyaka Upanishad,तं चेदेतस्मिन्वयसि किञ्चिदुपतपेत्स ब्रूयात्प्राणा वसव इदं मे प्रातःसवनं माध्यन्दिनँ् सवनमनुसन्तनुतेति माहं प्राणानां वसूनां मध्य यज्ञो विलोप्सीयेत्युद्धैव तत एत्यगदो ह भवति ।। 3.16.2 ।। 
Brihadaranyaka Upanishad,"अथ यानि चतुश्चत्वारि , शद्वर्षाणि तन्माध्यन्दिनँ् सवनं चतुश्चत्वारि , शदक्षरा त्रिष्टुप्त्रैष्टुभं माध्यन्दिनँ् सवनं तदस्य रुद्रा अन्वायत्ताः प्राणा वाव रुद्रा एते हीदँ् सर्वँ् रोदयन्ति ।। 3.16.3 ।।  "
Brihadaranyaka Upanishad,तं चेदेतस्मिन्वयसि किञ्चिदुपतपेत्स ब्रूयात्प्राणा रुद्रा इदं मे माध्यन्दिनँ् सवनं तृतीयसवनमनुसन्तनुतेति माहं प्राणानाँ् रुद्राणां मध्ये यज्ञो विलोप्सीयेत्युद्धैव तत एत्यगदो ह भवति ।। 3.16.4 ।। 
Brihadaranyaka Upanishad,"अथ यान्यष्टाचत्वारि , शद्वर्षाणि तत्तृतीयसवनमष्टाचत्वारि , शदक्षरा जगती जागतं तृतीयसवनं तदस्यादित्या अन्वायत्ताः प्राणा वावादित्या एते हीदँ् सर्वमाददते ।। 3.16.5 ।। "
Brihadaranyaka Upanishad,तं चेदेतस्मिन्वयसि किञ्चिदुपतपेत्स ब्रूयात्प्राणा आदित्या इदं मे तृतीयसवनमायुरनुसन्तनुतेति माहं प्राणानामादित्यानां मध्ये यज्ञो विलोप्सीयेत्युद्धैव तत एत्यगदो हैव भवति ।। 3.16.6 ।। 
Brihadaranyaka Upanishad,एतद्ध स्म वै तद्विद्वानाह महिदास ऐतरेयः स किं म एतदुपतपसि योऽहमनेन न प्रेष्यामिति स ह षोडशं वर्षशतमजीवत्प्र ह षोडशं वर्षशतं जीवति य एवं वेद ।। 3.16.7 ।। इति षोडशः खण्डः ।। 16 ।। 
Brihadaranyaka Upanishad,स यदशिशिषति यत्पिपासति यन्न रमते ता अस्य दीक्षाः ।। 3.17.1 ।। 
Brihadaranyaka Upanishad,अथ यदश्नाति यत्पिबति यद्रमते तदुपसदैरेति ।। 3.17.2 ।। 
Brihadaranyaka Upanishad,अथ यद्धसति यज्जक्षति यन्मैथुनं चरति स्तुतशस्त्रैरेव तदति ।। 3.17.3 ।। 
Brihadaranyaka Upanishad,"अथ यत्तपो दानमार्जवमहि , सा सत्यवचनमिति ता अस्य दक्षिणाः ।। 3.17.4 ।।"
Brihadaranyaka Upanishad,तस्मादाहुः सोष्यत्यसोष्टेति पुनरुत्पादनमेवास्य तन्मरणमेवावभृथः ।। 3.17.5 ।। 
Brihadaranyaka Upanishad,"तद्धैतद्घोर आङ्गिरसः कृष्णाय देवकीपुत्रायोक्त्वोवाचापिपास एव स बभूव सोऽन्तवेलायामेतत्त्र्यं प्रतिद्येताक्षितमस्यच्युतमसि प्राणस , शितमसीति तत्रैते द्वे ऋचौ भवतः ।। 3.17.6 ।। "
Brihadaranyaka Upanishad,आदित्प्रत्नस्य रेतसः ।  उद्वयं तमसस्परि ज्योतिः पश्यन्त उत्तरं स्वः पश्यन्त उत्तरं देवं देवत्रा सूर्यमगन्म ज्योतिरुत्तममिति ज्योतिरुत्तममिति ।। 3.17.7 ।। 
Brihadaranyaka Upanishad,"उद्वुयं तमसस्परि ज्योतिः पश्यन्त उत्तरं , स्वः पश्यन्त उत्तरं देवं देवत्रा सूर्यमगन्म ज्योतिरुत्तममिति ज्योतिरुत्तममिति ।। 3.17.8 ।। इति सप्तदशः खण्डः ।। 17 ।।    "
Brihadaranyaka Upanishad,मनो ब्रह्मेत्युपासीतेत्यध्यात्ममथाधिदैवतमाकाशो ब्रह्मेत्युभयमादिष्टं भवत्यध्यात्मंचाधिदैवतं च ।। 3.18.1 ।। 
Brihadaranyaka Upanishad,तदेतञ्चतुष्पाद्ब्रह्म वाक्पादः प्राणः पादश्चक्षुः पादः श्रोत्रं पाद इत्यध्यात्ममथाधिदैवतमग्निः पादो वायुः पाद आदित्यः पादो दिशः पाद इत्युभयमेवादिष्टं भवत्यध्यात्मं चैत्राधिदैवतं च ।। 3.18.2 ।। 
Brihadaranyaka Upanishad,वागेव ब्रह्मणश्चतुर्थः पादः सोऽग्निना ज्योतिषा भाति च तपति च भाति च तपति च कीर्त्या यशसा ब्रह्मवर्चसेन य एवं वेद ।। 3.18.3 ।। 
Brihadaranyaka Upanishad,प्राण एव ब्रह्मणश्चतुर्शः पादः स वायुना ज्योतिषा भाति च तपति च भाति च तपति च कीर्त्या यशसा ब्रह्मवर्चसेन य एवं वेद ।। 3.18.4 ।। 
Brihadaranyaka Upanishad,चक्षुरेव ब्रह्मणश्चतुर्थः पादः स आदित्येन ज्योतिषा भाति च तपति च भाति च तपति च कीर्त्या यशसा ब्रह्मवर्चसेन य एवं वेद ।। 3.18.5 ।। 
Brihadaranyaka Upanishad,श्रोत्रमेव ब्रह्मणश्चतुर्थः पादः स दिग्भिर्ज्योतिषा भाति च तपति च भाति च तपति च कीर्त्या यशसा ब्रह्मवर्चसेन य एवं वेद य एवं वेद ।। 3.18.6 ।। इत्यष्टादशः खण्डः ।। 18 ।। 
Brihadaranyaka Upanishad,आदित्यो ब्रह्मेत्यादेशस्तस्योपव्याख्यानमसदेवेदमग्र आसीत् ।।तत्सदासीत्तत्समभवत्तदाण्डं निरवर्तत तत्संवत्सरस्य मात्रामशयत तन्निरभिद्यत ते आण्डकपाले रजतं च सुवर्णं चाभवताम् ।। 3.19.1 ।। 
Brihadaranyaka Upanishad,"तद्यद्रजतँ् सेयं पृथिवी , यत्सुवर्णँ् सा द्यैर्यज्जरायु ते पर्वता यदुल्बं समेघो नीहारो या धमनयस्ता नद्यो यद्वास्तेयमुदकं स समुद्रः ।। 3.19.2 ।। "
Brihadaranyaka Upanishad,अथ यत्तदजायत सोऽसावादित्यस्तं जायमानं घोषा उलूलवोऽनूदतिष्ठन्सर्वाणि च भूतानि सर्वे च कामास्तस्मात्तस्योदयं प्रति प्रत्यायनं प्रति घोषा उलूलवोऽनूत्तिष्ठन्ति सर्वाणि च भूतानि सर्वे च कामाः ।। 3.19.3 ।। 
Brihadaranyaka Upanishad,स य एतमेवं विद्वानादित्यं ब्रह्मेत्युपास्तेऽभ्याशो ह यदेनँ् साधवो घोषा आ च गच्छेयुरुप च निम्रेडेरन्निम्रेडेरन् ।। 3.19.4 ।। इत्येकोनविंशः खण्डः ।। 19 ।। इति छान्दोग्योपनिषदि तृतीयोऽध्यायः ।। 3 ।।  
Brihadaranyaka Upanishad, जानश्रुतिर्ह पौत्रायणः श्रद्धादेयो बहुदायी बहुपाक्य आस स ह सर्वत आवसथान्मापयाञ्चक्रे सर्वत एव मेऽन्नमत्स्यन्तीति ।। 4.1.1 ।। 
Brihadaranyaka Upanishad,"अथ ह ह , सा निशायामतिपेतुस्तद्धैवँ् ह , सो ह , समभ्युवाद , हो होऽयि भल्लाक्ष भल्लाक्ष जानश्रुतेः पौत्रायणस्य समं दिवा ज्योतिराततं तन्मा प्रसाङ्क्षी स्तत्त्वा मा प्रधाक्षीरिति ।। 4.1.2 ।। "
Brihadaranyaka Upanishad,तमु ह परः प्रत्युवाच कम्वर एनमेतत्सन्तँ् सयुग्वानमिव रैक्कमात्थेति यो नु कथँ् सयुग्वा रैकक् इति ।। 4.1.3 ।। 
Brihadaranyaka Upanishad,यथा कृतायविजितायाधरेयाः संयन्त्येवमेनँ् सर्वं तदभिसमैति यत्किञ्च प्रजाः साधु कुर्वन्ति यस्तद्वेद यत्स वेद स मयैतदुक्त इति ।। 4.1.4 ।। 
Brihadaranyaka Upanishad,तदु ह जानश्रुतिः पौत्रायण उपशुश्राव स ह सञ्जिहान एव क्षत्तारमुवाचाङ्गारे ह सयुग्वानमिव रैक्कमात्थेति यो नु कथँ् सयुग्वा रैक्क इति ।। 4.1.5 ।। 
Brihadaranyaka Upanishad,यथा कृतायविजितायाधरेयाः संयन्त्येवमेनँ् सर्वं तदभिसमैति यत्किञ्च प्रजाः साधु कुर्वन्ति यस्तद्वेद यत्स वेद मयैतदुक्त इति ।। 4.1.6 ।। 
Brihadaranyaka Upanishad,"स ह क्षत्तान्विषय नाविदमिति प्रत्येयाय तँ् होवाच , यत्रारे ब्राह्मणस्यान्वेषणा तदेनमर्छेति ।। 4.1.7 ।। "
Brihadaranyaka Upanishad,सोऽधस्ताच्छकटस्य पामानं कषमाणमुपोपविवेश तँ् हाभ्युवाद त्वं नु भगवः सयुग्वा रैक्क इत्यहँ् ह्यरा3 इति ह प्रतिजज्ञे स ह क्षत्ताविदमिति प्रत्येयाय ।। 4.1.8 ।। इति प्रथमः खण्डः ।। 1 ।।  
Brihadaranyaka Upanishad,तदु ह जानश्रुतिः पौत्रायणः षट् शतानि गवां निष्कमश्वतरीरथं तदादाय प्रतिचक्त्रमे तँ् हाभ्युवाद ।। 4.2.1 ।। 
Brihadaranyaka Upanishad,रैक्केमानि षट् शतानि गवामयं निष्कोऽयमश्वतरीरथोऽन्तु म एतां भगवो देवताँ् शाधि यां देवतामुपास्स इति ।। 4.2.2 ।। 
Brihadaranyaka Upanishad,तमु ह परः प्रत्युवाचाह हारेत्वा शूद्र तवैव सह गोभिरस्त्विति तदु ह पुनरेव जानश्रुतिः पौत्रायणः सहस्रं गवां निष्कमश्वतरीरथं दुहितरं तदादाय प्रतिचक्त्रमे ।। 4.2.3 ।। 
Brihadaranyaka Upanishad,तँ् हाभ्युवाद रैक्वेदँ् सहस्रं गवामयं निष्कोऽयमश्वतरीरथ इयं जायायं ग्रामो यस्मिन्नास्सेऽन्वेव मा भगवः शाधीति ।। 4.2.4 ।। 
Brihadaranyaka Upanishad,तस्या ह मुखमुपोद्गृह्णन्नुवाचाजहारेमाः शूद्रानेनैव मुखेनालापयिष्यथा इति ते हैते रैक्कपर्णा नाम महावृषेषु यत्रास्मा उवास तस्मै होवाच ।। 4.2.5 ।। इति द्वितीयः खण्डः ।। 2 ।। 
Brihadaranyaka Upanishad,वायुर्वाव सम्वर्गो यदा वा अग्निरुद्वायति वायुमेवाप्येति यदा सूर्योऽस्तमेति वायुमेवाप्येति यदा चन्द्रोऽस्तमेति वायुमेवाप्येति ।। 4.3.1 ।। 
Brihadaranyaka Upanishad,यदाप उच्छुष्यन्ति वायुमेवापियन्ति वायुर्ह्येवैतान्सर्वान्संवृङ्क्त इत्यधिदैवतम् ।। 4.3.2 ।। 
Brihadaranyaka Upanishad,"अथाध्यात्मं प्राणो वाव सम्वर्गः स यदा स्वपिति प्राणमेव वागप्येति प्राणं चक्षुः प्राण , श्रोत्रं प्राणं मनः प्राणो ह्येवैतान्सर्वान्संवृङ्क्त इति ।। 4.3.3 ।। "
Brihadaranyaka Upanishad,तौ वा एतौ द्वौ सम्वर्गौ वायुरेव देवेषु प्राणः प्राणेषु ।। 4.3.4 ।। 
Brihadaranyaka Upanishad,अथ ह शौनकं च कापेयमभिप्रतारिणं च काक्षसेनिं परिविष्यमाणौ ब्रह्मचारी बिभिक्षे तस्मा उ ह न ददतुः ।। 4.3.5 ।। 
Brihadaranyaka Upanishad,स होवाच महात्मनश्चतुरो देव एकः कः स जगार भुवनस्य गोपास्तं कापेय नाभिपश्यन्ति मर्त्या अभिप्रतारिन्बहुधा वसन्तं यस्मै वा एतदन्नं तस्मा एतन्न दत्तमिति ।। 4.3.6 ।। 
