title,mantra
Katha Upanishad,"श्वोभावा मर्त्यस्य यदन्तकैतत् सर्वेन्द्रियाणां जरयन्ति तेजः ।,अपि सर्वं जीवितमल्पमेव तवैव वाहास्तव नृत्यगीते ।। 1.1.26 ।।"
Brihadaranyaka Upanishad,आगाता ह वै कामानां भवति य एतदेवं विद्वानक्षरमुद्गीथमुपास्त इत्यध्यात्मम् ।। 1.2.14 ।। इति द्वितीयः खण्डः ।। 2 ।।   
Svetashvatra Upanishad,"समे शुचौ शर्करावह्निवालुका विवर्जिते शब्दजलाश्रयादिभिः।,मनोनुकूले न तु चक्षुपीडने गुहानिवाताश्रयणे प्रयोजयेत्।।2.1.10।।"
Mundaka Upanishad,अग्निर्मूर्धा चक्षुषी चन्द्रसूर्यौ दिशः श्रोत्रे वाग्विवृताश्च वेदाः।  वायुः प्राणो हृदयं विश्वमस्य पद्भ्यां पृथिवी ह्येष सर्वभूतान्तरात्मा।।2.1.4।।
Kena Upanishad,"स तस्मिन्नेवाकाशे स्त्रियमाजगाम बहुशोभमानामुमा्ँ हैमवतीं ता्ँहोवाच किमेतद्यक्षमिति ।। 3.1.12 ।।,।। इति तृतीयः खण्डः ।।"
Aitereya Upanishad,सोऽस्यायमात्मा पुण्येभ्यः कर्मभ्यः प्रतिधीयते। अथास्यायमितर आत्मा कृतकृत्यो वयोगतः प्रैति स इतः प्रयन्नेव पुनर्जायते तदस्य तृतीयं जन्म।।1.4.4।।
Taittiriya Upanishad,यतो वाचो निवर्तन्ते। अप्राप्य मनसा सह। आनन्दं ब्रह्मणो विद्वान्। न बिभेति कदाचनेति। तस्यैष एव शरीर आत्मा। यः पूर्वस्य। तस्माद्वा एतस्मान्मनोमयात्। अन्योऽन्तर आत्मा विज्ञानमयः। तेनैष पूर्णः। स वा एष पुरुषविध एव। तस्य पुरुष विधताम्। अन्वयं पुरुषविधः। तस्य श्रद्धैव शिरः। ऋतं दक्षिणः पक्षः। सत्यमुत्तरः पक्षः। योग आत्मा। महः पुच्छं प्रतिष्ठा। तदप्येष श्लोको भवति।।2.4.1।।
Karika Upanishad,प्रणवो ह्यपरं ब्रह्म प्रणवश्च परं स्मृतः ।अपूर्वोऽनन्तरोऽबाह्योऽनपरः प्रणवोऽव्ययः ।। 1.1.26 ।।
Prasna Upanishad,"व्रात्यस्त्वं प्राणैकर्षिरत्ता विश्वस्य सत्पतिः।,वयमाद्यस्य दातारः पिता त्वं मातरिश्व नः।।2.1.11।।"
Katha Upanishad,"न वित्तेन तर्पणीयो मनुष्यो लप्स्यामहे वित्तमद्राक्ष्म चेत्त्वा ।,जीविष्यामो यावदीशिष्यसि त्वं वरस्तु मे वरणीयः स एव ।। 1.1.27 ।।"
Brihadaranyaka Upanishad,"अथाधिदैवतं य एवासौ तपति तमुद्गीथमुपासीतोद्यन्वा एष प्रजाभ्य उद्गायति ।  उद्य , स्तमो भयमपहन्त्यपहन्ता ह वै भयस्य तमसो भवति य एवं वेद ।। 1.3.1 ।।"
Svetashvatra Upanishad,"नीहारधूमार्कानलानिलानां खद्योतविद्युत्स्फटिकशशीनाम्।,एतानि रूपाणि पुरस्सराणि ब्रह्मण्यभिव्यक्तिकराणि योगे।।2.1.11।।"
Mundaka Upanishad,तस्मादग्निः समिधो यस्य सूर्यः सोमात्पर्जन्य ओषधयः पृथिव्याम्।  पुमान् रेतः सिञ्चति योषितायां बह्वी प्रजाः पुरूषात्संप्रसूताः।।2.1.5।।
Kena Upanishad,"चतुर्थः खण्डः,सा ब्रह्मेति होवाच ब्रह्मणो वा एतद्विजये महीयध्वमिति ततो हैव विदांचकार ब्रह्मेति ।। 4.1.1 ।।"
Aitereya Upanishad,तदुक्तमृषिणा। गर्भे नु सन्नन्वेषामवेदमहं देवानां जनिमानि विश्वा। शतं मा पुर आयसीररक्षन्नधः श्येनो जवसा निरदीयमिति गर्भ एवैतच्छयानो वामदेव एवमुवाच।।1.4.5।।
Taittiriya Upanishad,विज्ञानं यज्ञं तनुते। कर्माणि तनुतेऽपि च। विज्ञानं देवाः सर्वे। ब्रह्म ज्येष्ठमुपासते। विज्ञानं ब्रह्म चेद्वेद। तस्माच्चेन्न प्रमाद्यति। शरीरे पाप्मनो हित्वा। सर्वान्कामान्समश्नुत इति। तस्यैष एव शरीर आत्मा। यः पूर्वस्य।  तस्माद्वा एतस्माद्विज्ञानमयात्। अन्योऽन्तर आत्मानन्दमयः। तेनैष पूर्णः। स वा एष पुरुषविध एव। तस्य पुरुषविधताम्। अन्वयं पुरुषविधः। तस्य प्रियमेव शिरः। मोदो दक्षिणः पक्षः। प्रमोद उत्तरः पक्षः। आनन्द आत्मा। ब्रह्म पुच्छं प्रतिष्ठा। तदप्येष श्लोको भवति।।2.5.1।।
Karika Upanishad,सर्वस्य प्रणवो ह्यादिर्मध्यमन्तस्तथैव च ।एवं हि प्रणवं ज्ञात्वा व्यश्नुते तदनन्तरम् ।। 1.1.27 ।।
Prasna Upanishad,"या ते तनूर्वाचि प्रतिष्ठिता या श्रोत्रे या च चक्षुषि।,या च मनसि संतता शिवां तां कुरू मोत्क्रमीः।।2.1.12।।"
Katha Upanishad,"अजीर्यताममृतानामुपेत्य जीर्यन् मर्त्यः क्वधःस्थः प्रजानन् ।,अभिध्यायन् वर्णरतिप्रमोदानतिदीर्घे जीविते को रमेत ।। 1.1.28 ।।"
Svetashvatra Upanishad,"पृथिव्यप्तेजोऽनिलखे समुत्थिते,   पञ्चात्मके योगगुणे प्रवृत्ते।,न तस्य रोगो न जरा न मृत्युः,   प्राप्तस्य योगाग्निमयं शरीरम्।।2.1.12।।"
Brihadaranyaka Upanishad,समान उ एवाचं चासौ चोष्णोऽयमुष्णोऽसौ स्वर इतीममाचक्षते स्वर इति प्रत्यास्वर इत्युमं तस्माद्वा एतमिममसुं चोद्गीथमुपासीत ।। 1.3.2 ।। 
Mundaka Upanishad,तस्मादृचः साम यजू्ँषि दीक्षा यज्ञाश्च सर्व क्रतवो दक्षिणाश्च।  संवत्सरश्च यजमानश्च लोकाः सोमो यत्र पवते यत्र सूर्यः।।2.1.6।।
Kena Upanishad,"तस्माद्वा एते देवा अतितरामिवान्यान्देवान्यदग्निर्वायुरिन्द्रस्ते । ,ह्येनन्नेदिष्ठं पस्पर्शुस्ते ह्येनत्प्रथमो विदांचकार ब्रह्मेति ।। 4.1.2 ।। "
Taittiriya Upanishad,असन्नेव स भवति।  असद्ब्रह्मेति वेद चेत्। अस्ति ब्रह्मेति चेद्वेद। सन्तमेनं ततो विदुरिति। तस्यैष एव शरीर आत्मा। यः पूर्वस्य। अथातोऽनुप्रश्नाः। उताविद्वानमुं लोकं प्रेत्य। कश्च न गच्छती।3।  आहो विद्वानमुं लोकं प्रेत्य। कश्चित्समश्नुता।3। उ। सोऽकामयत। बहु स्यां प्रजायेयेति। स तपोऽतप्यत। स तपस्तप्तवा। इद्ँ सर्वमसृजत। यदिदं किं च। तत्सृष्ट्रा। तदेवानुप्राविशत्। तदनुप्रविश्य। सच्च त्यच्चाभवत्। निरुक्तं चानिरुक्तं च। निलयनं चानिलयनं च। विज्ञानं चाविज्ञानं च। सत्यं चानृतं च सत्यमभवत्। यदिदं किंच। यदिदं किंच। तत्सत्यमित्याचक्षते। तदप्येष श्लोको भवति।।2.6.1।।
Aitereya Upanishad,स एवं विद्वानस्माच्छरीरभेदादूर्ध्व उत्क्रम्यामुष्मिन् स्वर्गे लोके सर्वान् कामानाप्त्वाऽमृतः समभवत् समभवत्।।1.4.6।।
Karika Upanishad,प्रणवं हीश्वरं विद्यात्सर्वस्य हृदये स्थितम् ।सर्वव्यापिनमोंकारं मत्वा धीरो न शोचति ।। 1.1.28 ।।
Prasna Upanishad,"प्राणस्येदं वशे सर्वं त्रिदिवे यत्प्रतिष्ठितम्।,मातेव पुत्रान् रक्षस्व श्रीश्च प्रज्ञां च विधेहि न इति।।2.1.13।।,।।इति द्वितीयः प्रश्नः।।"
Katha Upanishad,"यस्मिन्निदं विचिकित्सन्ति मृत्यो यत् सांपराये महति ब्रूहि नस्तत् ।,योऽयं वरो गूढमनुप्रविष्टो नान्यं तस्मान्नचिकेता वृणीते ।। 1.1.29 ।।,               ।। इति प्रथमेऽध्याये प्रथमा वल्ली ।।		"
Svetashvatra Upanishad,"लघुत्वमारोग्यमलोलुपत्वं वर्णप्रसादं स्वरसौष्ठवं च।,गन्धः शुभो मूत्रपुरीषमल्पं योगप्रवृत्तिं प्रथमां वदन्ति।।2.1.13।।"
Brihadaranyaka Upanishad,अथ खलु व्यानमेवोद्गीथमुपासीत यद्वै प्राणिति स प्राणो यदपानिति सोऽपानः ।  अथ यः प्राणापानयोः सन्धिः स व्यानो यो व्यानः सा वाक् ।  तस्मादप्राणन्ननपानन्वाचमभिव्याहरति ।। 1.3.3 ।। 
Mundaka Upanishad,तस्माच्च देवा बहुधा संप्रसूताः साध्या मनुष्याः पशवो वयांसि।  प्राणापानौ व्रीहियवौ तपश्च क्षद्धा सत्यं ब्रह्मचर्यं विधिश्च।।2.1.7।।
Kena Upanishad,तस्माद्वा इन्द्रोऽतितरामिवान्यान्देवान्स ह्येनन्नेदिष्ठं पस्पर्श स ह्येनत्प्रथमो विदांचकार ब्रह्मेति ।। 4.1.3 ।।
Taittiriya Upanishad,असद्वा इदमग्र आसीत्। ततो वै सदजायत। तदात्मान्ँ स्वयमकुरुत। तस्मात्तत्सुकृतंमुच्यत इति। यद्वैतत्सुकृतम्। रसो वै सः। रस्ँह्येवायं लब्ध्वानन्दी भवती। को ह्येवान्यात्कः प्राण्यात्। तदेष आकाश आनन्दो न स्यात्। एष ह्येवानन्दयाति। यदा ह्येवैष एतस्मिन्नदृश्येऽनात्म्येऽनिरुक्तेऽनिलयनेऽभयं प्रतिष्ठां विन्दते। अथ सोऽभयं गतो भवति। यदा ह्येवैष एतस्मिन्नुदरमन्तरं कुरुते। अथ तस्य भयं भवति। तत्त्वेव भयं विदुषोऽमन्वानस्य। तदप्येष श्लोको भवति।।2.7.1।।
Aitereya Upanishad,कोऽयमात्मेति वयमुपास्महे कतरः स आत्मा । येन वा पश्यति येन वा शृणोति येन वा गंधानाजिघ्रति येन वा वाचं व्याकरोति येन वा स्वादु चास्वादु च विजानाति।।1.5.1।।
Karika Upanishad,अमात्रोऽनन्तमात्रश्च द्वैतस्योपशमः शिवः ।ओंकारो विदितो येन स मुनिर्नेतरो जनः ।। 1.1.29 ।।
Prasna Upanishad,अथ हैनं कौसल्यश्चाश्वलायनः पप्रच्छ। भगवन्कुत एष प्राणो जायते कथमायात्यस्मिञ्छरीर आत्मानं वा प्रविभज्य कथं प्रातिष्ठते केनोत्क्रमते कथं बाह्यमभिधत्ते कथमध्यात्ममिति।।3.1.1।।
Katha Upanishad,"अन्यच्छ्रेयोऽन्यदुतैव प्रेयस्ते उभे नानार्थे पुरुष्ँसिनीतः ।,तयोः श्रेय आददानस्य साधुर्भवति हीयतेऽर्थाद्य उ प्रेयो वृणीते ।। 1.2.1 ।।"
Svetashvatra Upanishad,"यथैव बिम्बं मृदयोपलिप्तं तेजोमयं भ्राजते तत्सुधान्तम्।,तद्वात्मतत्वं प्रसमीक्ष्य देही एकः कृतार्थो भवते वीतशोकः।।2.1.14।।"
Brihadaranyaka Upanishad,या वाक्सर्क्तस्मादप्राणन्ननपानन्नृचमभिव्याहरति यर्क्तत्साम तस्मादप्राणन्ननपानन्साम गायति यत्साम स उद्गीथस्तस्मादप्राणन्ननपानन्नुद्गायति ।। 1.3.4 ।। 
Mundaka Upanishad,"सप्त प्राणाः प्रभवन्ति तस्मात्सप्तार्चिषः समिधः सप्त होमाः।  सप्त इमे लोका येषु चरन्ति प्राणा गुहाशया निहिताः सप्त सप्त।।,।।2.1.8।।"
Kena Upanishad,तस्यैष आदेशो यदेतद्विद्युतो व्यद्युतदा3 इतीन्न्यमीमिषदा3 इत्यधिदैवतम् ।। 4.1.4 ।।
Taittiriya Upanishad,"भीषाऽस्माद्वातः पवते। भीषोदेति सूर्यः। भीषाऽस्मादग्निश्चेन्द्रश्च। मृत्युर्धावति पञ्चम इति। सैषाऽऽनन्दस्य मीमा्ँसा , भवति। युवा स्यात्साधु युवाध्यायकः। आशिष्ठो द्रढिष्ठो बलिष्ठः। तस्येयं पृथिवी सर्वा वित्तस्य पूर्णा स्यात्। स एको मानुष आनन्दः। ते ये शतं मानुषा आनन्दाः। स एको मनुष्यगन्धर्वाणामानन्दः। श्रोत्रियस्य चाकामहतस्य। ते ये शतं मनुष्यगन्धर्वाणामानन्दाः। स एको देवगन्धवार्णामानन्दः। श्रोत्रियस्य चाकामहतस्य। ते ये शतं देवगन्धवार्णामानन्दाः। स एक पितृणां चिरलोकलोकानामानन्दः। श्रोत्रियस्य चाकामहतस्य। ते ये शतं पितृणां चिरलोकलोकानामानन्दाः। स एक आजानजानां देवानामानन्दः। श्रोत्रियस्य चाकामहतस्य। ते ये शतमाजानजानां देवानामानन्दाः। स एकः कर्मदेवानाम् देवानामानन्दः। ये कर्मणा देवानपियन्ति। श्रोत्रियस्य चाकामहतस्य। ते ये शतं कर्मदेवानाम् देवानामानन्दाः। स एको देवानामानन्दाः। श्रोत्रियस्य चाकामहतस्य। ते ये शतं देवानामानन्दाः। स एक इन्द्रस्यानन्दः। श्रोत्रियस्य चाकामहतस्य। ते ये शतमिन्द्रस्यानन्दाः। स एको बृहस्पतेरानन्दः। श्रोत्रियस्य चाकामहतस्य। ते ये शतं बृहस्पतेरानन्दाः। स एकः प्रजापतेरानन्दः। श्रोत्रियस्य चाकामहतस्य। ते ये शतं प्रजापतेरानन्दाः। स एको ब्रह्मण आनन्दः। श्रोत्रियस्य चाकामहतस्य। स यश्चायं पुरुषे। यश्चासावादित्ये। स एकः। स य एवंवित्। अस्माल्लोकात्प्रेय। एतमन्नमयमात्मानमुपसंक्रामति। एतं प्राणमयमात्मानमुपसंक्रामति। एतं मनोमयमात्मानमुपसंक्रामति। एतं विज्ञानमयमात्मानमुपसंक्रामति। एतमानन्दमयमात्मानमुपसंक्रामति।  तदप्येष श्लोको भवति।।।2.8.1।।"
Aitereya Upanishad,यदेतत् हृदयं मनश्चैतत्। संज्ञानमाज्ञानं विज्ञानं प्रज्ञानं मेधा दृष्टिर्धृतिर्मतिर्मनीषा जूतिः स्मृतिः संकल्पः क्रतुरसुः कामो वश इति। सर्वाण्येवैतानि प्रज्ञानस्य नामधेयानि भवन्ति।।1.5.2।।
Prasna Upanishad,तस्मै स होवाचातिप्रश्नान्पृच्छसि ब्रह्मिष्ठोऽसीति तस्मात्तेऽहं ब्रवीमि।।3.1.2।।
Karika Upanishad,इति प्रथममागमप्रकरणं संपूर्णम् ।।
Katha Upanishad,"श्रेयश्च प्रेयश्च मनुष्यमेतस्तौ संपरीत्य विविनक्ति धीरः ।,श्रेयो हि धीरोऽभि प्रेयसो वृणीते प्रेयो मन्दो योगक्षेमाद्वृणीते ।। 1.2.2 ।।"
Svetashvatra Upanishad,"यदात्मतत्त्वेन तु ब्रह्मतत्त्वं दीपोपमेनेह युक्तः प्रपश्येत्।,अजं ध्रुवं सर्वतत्त्वैर्विशुद्धं ज्ञात्वा देवं मुच्यते सर्वपाशैः।।2.1.15।।"
Brihadaranyaka Upanishad,"अतो यान्यन्यानि वीर्यवन्ति कर्माणि यथाग्नेर्मन्थनमाजेः सरणं दृढस्य धनुष आयमनमप्राणन्ननपान , स्तानि करोत्येतस्य हेतोर्व्यानमेवोद्गीथमुपासीत ।। 1.3.5 ।।"
Mundaka Upanishad,अतः समुद्रा गिरयश्च सर्वेऽस्मात्स्यन्दन्ते सिन्धवः सर्वरूपाः।  अतश्च सर्वा ओषधयो रसश्च येनैष भूतैस्तिष्ठते ह्यन्तरात्मा।।2.1.9।।
Kena Upanishad,अथाध्यात्मं यदेतद्गच्छतीव च मनोऽनेन चैतदुपस्मरत्यभीक्ष्ण्ँ संकल्पः ।। 4.1.5 ।।
Taittiriya Upanishad,"यतो वाचो निवर्तन्ते। अप्राप्य मनसा सह। आनन्दं ब्रह्मणो विद्वान्। न बिभेति कुतश्चनेति। , एत्ँह , वाव न तपति। , किमह्ँसाधु नाकरवम्। किमहं पापमकरवमिति। स य एवं विद्वानेते आत्मान्ँ स्पृणुते। उभे ह्येवैष एते आत्मान्ँ स्पृणुते। य एवं वेद। इत्युपनिषत्।।2.9.1।।"
