title,mantra
Karika Upanishad,नात्मभावेन नानेदं न स्वेनापि कथंचन ।न पृथङ् नापृथक्किंचिदिति तत्त्वविदो विदुः ।। 2.1.34 ।।
Katha Upanishad,"महतः परमव्यक्तमव्यक्तात् पुरुषः परः ।,पुरुषान्न परं किंचित् सा काष्ठा सा परा गतिः ।। 1.3.11 ।।"
Svetashvatra Upanishad,"यो योनिं योनिमधितिष्ठत्येको यस्मिन्निदं सं च विचैति सर्वम्।,तमीशानं वरदं देवमीड्यं निचाय्येमां शान्तिमत्यन्तमेति।।4.1.11।।"
Brihadaranyaka Upanishad,"अथानेनैव ये चैतस्मादर्वाञ्चो लोकास्ता , श्चाप्नोति मनुष्यकामा , श्च तस्मादु हैवंविदुद्गाता ब्रूयात् ।। 1.7.8 ।। "
Prasna Upanishad,"विज्ञानात्मा सहदेवैश्च सर्वैः प्राणा भूतानि संप्रतिष्ठन्ति यत्र। तदक्षरं वेदयते यस्तु सोम्य स सर्वज्ञः सर्वमेवाविवेशेति।।5.1.11।।,।।इति चतुर्थः प्रश्नः।।"
Karika Upanishad,वीतरागभयक्रोधैर्मुनिभिर्वेदपारगैः ।निर्विकल्पो ह्ययं दृष्टः प्रपञ्चोपशमोऽद्वयः ।। 2.1.35 ।।
Katha Upanishad,"एष सर्वेषु भूतेषु गूढोऽऽत्मा न प्रकाशते ।,दृश्यते त्वग्र्यया बुद्ध्या सूक्ष्मया सूक्ष्मदर्शिभिः ।। 1.3.12 ।।"
Prasna Upanishad,"।।इति पञ्चमः प्रश्नः।।,षष्ठ प्रश्न,अथ हैनं सुकेशा भारद्वाजः पप्रच्छ। भगवन्हिरण्यनाभः कौसल्यो राजपुत्रो मामुपेत्यैतं प्रश्नमपृच्छत। षोडशकलं भारद्वाज पुरूषं वेत्थ। तमहं कुमारमब्रुवं नाहमिमं वेद। यद्यहमिममवेदिषं कथं ते नावक्ष्यमिति। समूलो वा एष परिशुष्यति योऽनृतमभिवदति तस्मान्नार्हाम्यनृतं वक्तुम्। स तूष्णीं रथमारूह्य प्रवव्राज। तं त्वा पृच्छामि क्वासौ पुरूष इति।।6.1.1।।"
Brihadaranyaka Upanishad,"कं ते काममागायानीत्येष ह्येव कामागानस्येष्टे य एवं विद्वान्साम गायति साम गायति ।। 1.7.9 ।। इति सप्तमः खण्डः ।। 7 ।।  , "
Svetashvatra Upanishad,"यो देवानां प्रभवश्चोद्भवश्च विश्वाधिपो रुद्रो महर्षिः।,हिरण्यगर्भं पश्यत जायमानं स नो बुद्ध्या शुभया संयुनक्तु।।4.1.12।।"
Karika Upanishad,तस्मादेवं विदित्वैनमद्वैते योजयेत्स्मृतिम् ।अद्वैतं समनुप्राप्य जडवल्लोकमाचरेत् ।। 2.1.36 ।।
Katha Upanishad,"यच्छेद्वाङ्मनसी प्राज्ञस्तद्यच्छेज्ज्ञान आत्मनि ।,ज्ञानमात्मनि महति नियच्छेत्तद्यछेच्छान्त आत्मनि ।। 1.3.13 ।।"
Prasna Upanishad,तस्मै स होवाच। इहैवान्तःशरीरे सोम्य स पुरूषो यस्मिन्नेताः षोडशकलाः प्रभवन्तीति।।6.1.2।।
Brihadaranyaka Upanishad,त्रयो  होद्गीथे कुशला बभूवुः शिलकः शालावत्यश्चैकितायनो दाल्भ्यः प्रवाहणो जैवलिरिति ते होचुरुद्गीथे वै कुशलाः स्मो हन्तोद्गीथे कथां वदाम इति ।। 1.8.1 ।।  
Svetashvatra Upanishad,"यो देवानामधिपो यस्मिन्ल्लोका अधिश्रिताः।,य ईशे अस्य द्विपदश्चतुष्पदः कस्मै देवाय हविषा विधेम।।4.1.13।।"
Karika Upanishad,निःस्तुतिर्निर्नमस्कारो निःस्वधाकार एव च ।चलाचलनिकेतश्च यतिर्यादृच्छिको भवेत् ।। 2.1.37 ।।
Katha Upanishad,"उत्तिष्ठत जाग्रत प्राप्य वरान् निबोधत ।,क्षुरस्य धारा निशिता दुरत्यया दुर्गं पथस्तत् कवयो वदन्ति ।। 1.3.14 ।।"
Prasna Upanishad,स ईक्षांचक्रे। कस्मिन्नहमुत्क्रान्त उत्क्रान्तो भविष्यामि कस्मिन्वा प्रतिष्ठिते प्रतिष्ठास्यामीति।।6.1.3।।
Brihadaranyaka Upanishad,तथेति ह समुपविविशुः स ह प्रवाहणो जैवलिरुवाच भगवन्तावग्रे वदतां ब्राह्मणयोर्वदतोर्वाचँ् श्रोष्यामीति ।। 1.8.2 ।। 
Svetashvatra Upanishad,"सूक्ष्मातिसूक्ष्मं कलिलस्य मध्ये विश्वस्य स्रष्टारमनेकरूपम्।,विश्वस्यैकं परिवेष्टितारं ज्ञात्वा शिवं शान्तिमत्यन्तमेति।।4.1.14।।"
Karika Upanishad,तत्त्वमाध्यात्मिकं दृष्ट्वा तत्त्वं दृष्ट्वा तु बाह्यतः ।तत्त्वीभूतस्तदारामस्तत्त्वादप्रच्युतो भवेत् ।। 2.1.38 ।।
Katha Upanishad,"अशब्दमस्पर्शमरूपमव्ययं तथाऽरसं नित्यमगन्धवच्च यत् ।,अनाद्यनन्तं महतः परं ध्रुवं निचाय्य तन्मृत्युमुखात् प्रमुच्यते ।। 1.3.15 ।।"
Prasna Upanishad,स प्राणमसृजत प्राणाच्छ्रद्धां स्वं वायुर्जोतिरापः पृथिवीन्द्रियं मनः अन्नम्न्नाद्वीर्यं तपो मन्त्राः कर्म लोका लाकेषु च नाम च।।6.1.4।।
Brihadaranyaka Upanishad,स ह शिलकः शालावत्यश्चैकितायनं दाल्भ्यमुवाच हन्त वा पृच्छानीति पृच्छेति होवाच ।। 1.8.3 ।। 
Svetashvatra Upanishad,"स एव काले भुवनस्य गोप्ता,    विश्वाधिपः सर्वभूतेषु गूढः।,यस्मिन् युक्ता ब्रह्मर्षयो देवताश्च,     तमेवं ज्ञात्वा मृत्युपाशांश्छिनत्ति।।4.1.15।।"
Karika Upanishad,इति द्वितीयं वैतथ्यप्रकरणं संपूर्णम् ।।
Katha Upanishad,"नाचिकेतमुपाख्यानं मुत्युप्रोक्त्ँ सनातनम् ।,उक्त्वा श्रुत्वा च मेधावी ब्रह्मलोके महीयते ।। 1.3.16 ।।"
Prasna Upanishad,स यथेमा नद्यः स्यन्दमानाः समुद्रायणाः समुद्रं प्राप्यास्तं गच्छन्ति भिद्येते तासां नामरूपे समुद्र इत्येवं प्रोच्यते। एवमेवास्य परिद्रष्टुरिमाः षोडशकलाः पुरूषायणाः पुरुषं प्राप्यास्तं गच्छन्ति भिद्येते चासां नामरूपे पुरूष इत्येवं प्रोच्यते स एषोऽकलोऽमृतो भवति तदेष श्लोकः।।6.1.5।।
Brihadaranyaka Upanishad,का साम्नो गतिरिति स्वर इति होवाच स्वरस्य का गतिरिति प्राण इति होवाच प्राणस्य का गतिरित्यन्नमिति होवाचान्नस्य का गतिरित्याप इति होवाच ।। 1.8.4 ।। 
Svetashvatra Upanishad,"घृतात् परं मण्डमिवातिसूक्ष्मं ज्ञात्वा शिवं सर्वभूतेषु गूढ़म्।,विश्वस्यैकं परिवेष्टितारं ज्ञात्वा देवं मुच्यते सर्वपाशैः।।4.1.16।।"
Karika Upanishad,उपासनाश्रितो धर्मो जाते ब्रह्मणि वर्तते ।प्रागुत्पत्तेरजं सर्वं तेनासौ कृपणः स्मृतः ।। 3.1.1 ।।
Katha Upanishad,"य इमं परमं गुह्यं श्रावयेत् ब्रह्मसंसदि ।,प्रयतः श्राद्धकाले वा तदानन्त्याय कल्पते ,             तदानन्त्याय कल्पत इति ।। 1.3.17 ।।,।। इति प्रथमेऽध्याये तृतीया वल्ली ।।"
Prasna Upanishad,अरा इव रथनाभौ कला यस्मिन्प्रतिष्ठिताः। तं वेद्यं पुरूषं वेद यथा मा वो मृत्युः परिव्यथा इति।।6.1.6।।
Svetashvatra Upanishad,"एष देवो विश्वकर्मा महात्मा सदा जनानां हृदये सन्निविष्टः।,हृदा मनीषा मनसाऽभिक्लृप्तो य एतद् विदुरमृतास्ते भवन्ति।।4.1.17।।"
Brihadaranyaka Upanishad,"अपां का गतिरित्यसौ लोक इति होवाचामुष्य लोकस्य का गतिरिति न स्वर्गं लोकमतिनयेदिति होवाच स्वर्गं वयं लोकँ् सामाभिस , स्थापयामः स्वर्गस , स्तावँ् , हि सामेति ।। 1.8.5 ।।  "
Karika Upanishad,अतो वक्ष्याम्यकार्पण्यमजाति समतां गतम् ।यथा न जायते किंचिज्जायमानं समन्ततः ।। 3.1.2 ।।
Prasna Upanishad,तान्होवाचैतावदेवाहमेतत्परं ब्रह्म वेद नातः परमस्तीति।।6.1.7।।
Svetashvatra Upanishad,"यदाऽतमस्तन्न दिवा न रात्रिः न सन्नचासच्छिव एव केवलः।,तदक्षरं तत् सवितुर्वरेण्यं प्रज्ञा च तस्मात् प्रसृता पुराणी।।4.1.18।।"
Brihadaranyaka Upanishad,"त ,  ह शिलकः शालावत्यश्चैकितायनं दाल्भ्यमुवाचाप्रतिष्ठितं वै किल ते दाल्भ्य साम यस्त्वेतर्हि ब्रूयान्मूर्धा ते विपतिष्यतीती मूर्धा ते विपतेदिति ।। 1.8.6 ।। "
Karika Upanishad,आत्मा ह्याकाशवज्जीवैर्घटाकाशैरिवोदितः ।घटादिवच्च संघातैर्जातावेतन्निदर्शनम् ।। 3.1.3 ।।
Prasna Upanishad,"ते तमर्चयन्तस्त्वं हि नः पिता योऽस्माकमविद्यायाः परं पारं तारयसीति। नमः परमऋषिभ्यो नमः परमऋषिभ्यः।।6.1.8।।, भद्रं कर्णेभिः , श्रृणुयाम देवा भद्रं पश्येमाक्षभिर्यजत्राः। स्थिरैरङ्गैस्तुष्टुवा्ँसस्तनूभिर्व्यशेम देवहितं यदायुः। स्वस्ति न इन्द्रो वृद्धश्रवाः स्वस्ति नः पूषा विश्ववेदाः। स्वस्ति नस्तार्क्ष्यो अरिष्टनेमिः स्वस्ति नो बृहस्पतिर्दधातु।।, शान्तिः शान्तिः शान्तिः।।,।।इति प्रश्नोपनिषत्समाप्ता।।"
Svetashvatra Upanishad,"नैनमूर्ध्वं न तिर्यञ्चं न मध्ये परिजग्रभत्।,न तस्य प्रतिमा अस्ति यस्य नाम महद् यशः।।4.1.19।।"
Brihadaranyaka Upanishad,"हन्ताहमेतद्भगवतो वेदानीति विद्धीति होवाचामुष्य लोकस्य का गतिरित्ययं लोक इति होवाचास्य लोकस्य का गतिरिति न प्रतिष्ठां लोकमतिनयेदिति होवाच प्रतिष्ठां वयं लोक , सामाभिस , स्थापयामः प्रतिष्ठास , स्तावँ् हि , सामेति ।। 1.8.7 ।। "
Karika Upanishad,घटादिषु प्रलीनेषु घटाकाशादयो यथा ।आकाशे संप्रलीयन्ते तद्वज्जीवा इहात्मनि ।। 3.1.4 ।।
Prasna Upanishad, सुकेशा च भारद्वाजः शैब्यश्च सत्यकामः सौर्यायणी च गार्ग्यः कौशल्यश्चाश्वलायनो भार्गवो वैदर्भिः कबन्धी कात्यायनस्ते हैते ब्रह्मपरा ब्रह्मनिष्ठाः परं ब्रह्मान्वेषमाणा एष ह वै तत्सर्वं वक्ष्यतीति ते ह समित्पाणयो भगवन्तं पिप्पलादमुपसन्नाः।।1.1.1।।
Svetashvatra Upanishad,"न संदृशे तिष्ठति रूपमस्य न चक्षुषा पश्यति कश्चनैनम्।,हृदा हृदिस्थं मनसा य एनमेवं विदुरमृतास्ते भवन्ति।।4.1.20।।"
Brihadaranyaka Upanishad,तँ् ह प्रवाहणो  जैवलिरुवाचान्तवद्वै किल ते शालवत्य साम यस्त्वेतर्हि ब्रूयान्मूर्धा ते विपतिष्यतीति मूर्धा ते विपतेदिति हन्ताहमेतद्भगवतो वेदानीति विद्धीति होवाच ।। 1.8.8 ।। इत्यष्टमः खण्डः ।। 1.8.8 ।।               
Karika Upanishad,यथैकस्मिन्घटाकाशे रजोधूमादिभिर्युते ।न सर्वे संप्रयुज्यन्ते तद्वज्जीवाः सुखादिभिः ।। 3.1.5 ।।
Svetashvatra Upanishad,"अजात इत्येवं कश्चिद्भीरुः प्रपद्यते।,रुद्र यत्ते दक्षिणं मुखं तेन मां पाहि नित्यम्।।4.1.21।।"
Brihadaranyaka Upanishad,अस्य लोकम्य का गतिरित्याकाश इति होवाच सर्वाणि ह वा इमानि भूतान्याकाशादेव समुत्पद्यन्त आकाशं प्रत्यम्तं यन्त्याकाशो ह्येवैभ्यो ज्यायानाकाशः परायणम् ।। 1.9.1 ।। 
Karika Upanishad,रूपकार्यसमाख्याश्च भिद्यन्ते तत्र तत्र वै ।आकाशस्य न भेदोऽस्ति तद्वज्जीवेषु निर्णयः ।। 3.1.6 ।।
Svetashvatra Upanishad,मा नस्तोके तनये मा न आयुषि मा नो गोषु मा नो अश्वेषु रीरिषः।  वीरान्मा नो रुद्र भामितोऽवधीर्हविष्मन्तः सदमित्त्वा हवामहे।।4.1.22।।
Karika Upanishad,नाकाशस्य घटाकाशो विकारावयवौ यथा ।नैवात्मनः सदा जीवो विकारावयवौ तथा ।। 3.1.7 ।।
Brihadaranyaka Upanishad,"स एष परोबरीयानुद्गीथः स एषोऽनन्तः परोवरीयो हास्य भवति परोवरीयसो ह लोकाञ्जयति य एतदेवं विद्वान् , परोवरीया , समुद्गीथमुपास्ते , ।। 1.9.2 ।। "
Svetashvatra Upanishad,"द्वे अक्षर ब्रह्मपरे त्वनन्ते विद्याविद्ये निहिते यत्र गूढे।,क्षरं त्वविद्या ह्यमृतं तु विद्या विद्याविद्ये ईशते यस्तु सोऽन्यः।।5.1.1।।"
Karika Upanishad,यथा भवति बालानां गगनं मलिनं मलैः ।तथा भवत्यबुद्धानामात्मापि मलिनो मलैः ।। 3.1.8 ।।
Brihadaranyaka Upanishad,तँ् हैतमतिधन्वा शौनक उदरशाण्डल्यायोक्त्वोवाच यावत्त एनं प्रजांयामुद्गीथं वेदिष्यन्ते परोवरीयो हैभ्यस्तावदस्मिंल्लोके जीवनं भविष्यति ।। 1.9.3 ।।
Svetashvatra Upanishad,"यो योनिं योनिमधितिष्ठत्येको विश्वानि रूपाणि योनीश्च सर्वाः।,ऋषिं प्रसूतं कपिलं यस्तमग्रे ज्ञानैर्बिभर्ति जायमानं च पश्येत्।।5.1.2।।"
Karika Upanishad,मरणे संभवे चैव गत्यागमनयोरपि ।स्थितौ सर्वशरीरेषु चाकाशेनाविलक्षणः ।। 3.1.9 ।।
Brihadaranyaka Upanishad,तथामुष्मिँल्लोके लोक इति स य एतदेवं विद्वानुपास्ते परोवरीय एव हास्यास्मिंल्लोके जीवनं भवति तथामुष्मिंल्लोके लोक इति लोके लोक इति ।। 1.9.4 ।। इति नवमः खण्डः ।। 9 ।।  
Svetashvatra Upanishad,"एकैकं जालं बहुधा विकुर्वन्नस्मिन् क्षेत्रे संहरत्येष देवः।,भूयः सृष्ट्वा पतयस्तथेशः सर्वाधिपत्यं कुरुते महात्मा।।5.1.3।।"
Karika Upanishad,संघाताः स्वप्नवत्सर्व आत्ममायाविसर्जिताः ।आधिक्ये सर्वसाम्ये वा नोपपत्तिर्हि विद्यते ।। 3.1.10 ।।
Brihadaranyaka Upanishad,मटचीहतेषु कुरुष्वाटिक्या सह जाययोषस्तिर्ह चाक्त्रायण इभ्यग्रामे प्रद्राणक उवास ।। 1.10.1 ।। 
Svetashvatra Upanishad,"सर्वा दिश ऊर्ध्वमधश्च तिर्यक् प्रकाशयन् भ्राजते यद्वनड्वान्।,एवं स देवो भगवान् वरेण्यो योनिस्वभावानधितिष्ठत्येकः।।5.1.4।।"
Karika Upanishad,रसादयो हि ये कोशा व्याख्यातास्तैत्तिरीयके ।तेषामात्मा परो जीवः खं यथा संप्रकाशितः ।। 3.1.11 ।।
Brihadaranyaka Upanishad,"स हेभ्यं कुल्माषान्खादन्तं बिभिक्षे तँ् , होवाच ।  नेतोऽन्ये विद्यन्ते यञ्च ये म इम उपनिहिता इति ।। 1.10.2 ।।"
Svetashvatra Upanishad,"यच्च स्वभावं पचति विश्वयोनिः पाच्यांश्च सर्वान् परिणामयेद् यः।,सर्वमेतद् विश्वमधितिष्ठत्येको गुणांश्च सर्वान् विनियोजयेद् यः।।5.1.5।।"
Karika Upanishad,द्वयोर्द्वयोर्मधुज्ञाने परं ब्रह्म प्रकाशितम् ।पृथिव्यामुदरे चैव यथाकाशः प्रकाशितः ।। 3.1.12 ।।
Brihadaranyaka Upanishad,"एतेषां मे देहीति होवाच तानस्मै प्रददौ हन्तानुपानमित्युच्छिष्टं वै मे पीतँ् , स्यादिति होवाच ।। 1.10.3 ।। "
Svetashvatra Upanishad,"तद् वेदगुह्योपनिषत्सु गूढं तद् ब्रह्मा वेदते ब्रह्मयोनिम्।,ये पूर्वं देवा ऋषयश्च तद् विदुस्ते तन्मया अमृता वै बभूवुः।।5.1.6।।"
Karika Upanishad,जीवात्मनोरनन्यत्वमभेदेन प्रशस्यते ।नानात्वं निन्द्यते यच्च तदेवं हि समुञ्जसम् ।। 3.1.13 ।।
Brihadaranyaka Upanishad,न स्विदेतेऽप्युच्छिष्टा इति न वा अजीविष्यमिमानखादन्निति होवाच कामो म उदपानमिति ।। 1.10.4 ।।
