title,mantra
Aitereya Upanishad,आत्मा वा इदमेक एवाग्र आसीत्। नान्यत् किंचन मिषत्। स ईक्षत लोकान्नु सृजा इति।।1.1.1।।
Katha Upanishad,तस्य ह नचिकेता नाम पुत्र आस ।। 1.1.1 ।।
Mandukya Upanishad,हरिः ।  ओमित्येतदक्षरमिद्ँ सर्वं तस्योपव्याख्यानं भूतं भवद्भविष्यदिति सर्वमोङ्कार एव। यच्चान्यत्त्रिकालातीतं तदप्योङ्कार एव ।। 1.1.1 ।।
Karika Upanishad,बहिःप्रज्ञो विभुर्विश्वो ह्यन्तःप्रज्ञस्तु तैजसः ।घनप्रज्ञस्तथा प्राज्ञ एक एव त्रिधा स्थितः ।। 1.1.1 ।।
Prasna Upanishad, सुकेशा च भारद्वाजः शैब्यश्च सत्यकामः सौर्यायणी च गार्ग्यः कौशल्यश्चाश्वलायनो भार्गवो वैदर्भिः कबन्धी कात्यायनस्ते हैते ब्रह्मपरा ब्रह्मनिष्ठाः परं ब्रह्मान्वेषमाणा एष ह वै तत्सर्वं वक्ष्यतीति ते ह समित्पाणयो भगवन्तं पिप्पलादमुपसन्नाः।।1.1.1।।
Mundaka Upanishad,ब्रह्मा देवानां प्रथमः संबभूव विश्वस्य कर्ता भुवनस्य गोप्ता। स ब्रह्मविद्यां सर्वविद्याप्रतिष्ठामथर्वाय ज्येष्ठपुत्राय प्राह।।1.1.1।।
Isavasya Upanishad,"0ईशावास्य उपनिषद्, पूर्णमदः पूर्णमिदं पूर्णात्पूर्णमुदच्यते ।,पूर्णस्य पूर्णमादाय पूर्णमेवावशिष्यते ।। , शान्तिः शान्तिः शान्तिः ।। , ईशावास्यमिदँ् सर्वं यत्किञ्च जगत्यां जगत् ।,तेन त्यक्तेन भुञ्जीथा मा गृधः कस्य स्विद्धनम् ।। 1.1.1 ।।"
Kena Upanishad,"0केन उपनिषद्, आप्यायन्तु ममाङ्गानि वाक्प्राणश्चक्षुः श्रोत्रमथो बलमिन्द्रियाणि च सर्वाणि। सर्वं ब्रह्मौपनिषदं माहं ब्रह्म निराकुर्यां मा मा ब्रह्म निराकरोदनिराकरणमस्त्वनिराकरणं मेऽस्तु। तदात्मनि निरते य उपनिषत्सु धर्मास्ते मयि सन्तु ते मयि सन्तु ।।, शान्तिः शान्तिः शान्तिः ।।,प्रथमः खण्डः, केनेषितं पतति प्रेषितं मनः केन प्राणः प्रथमः प्रैति युक्तः ।,केनेषितां वाचमिमां वदन्ति चक्षुः श्रोत्रं क उ देवो युनक्ति ।। 1.1.1 ।।"
Taittiriya Upanishad, शं नो मित्रः शं वरुणः। शं नो भवत्वर्यमा। शं न इन्द्रो बृहस्पतिः। शं नो विष्णुरुरुक्रमः। नमो ब्रह्मणे। नमस्ते वायो। त्वेमेव प्रत्यक्षं ब्रह्मासि। त्वामेव प्रत्यक्षं ब्रह्म वदिष्यामि। ऋतं वदिष्यामि। सत्यं वदिष्यामि। तन्मामवतु। तद्वक्तारमवतु। अवतु मां। अवतु वक्तारं। (सत्यं वदिष्यामि इति पञ्च च)।।1.1.1।।
Svetashvatra Upanishad,"हरि । ब्रह्मवादिनो वदन्ति। ,  किं कारणं ब्रह्म कुतः स्म जाता ,    जीवाम केन क्व संप्रतिष्ठः।,      अधिष्ठिताः केन सुखेतरेषु ,         वर्तामहे ब्रह्मविदो व्यवस्थाम्।।1.1.1।।"
Brihadaranyaka Upanishad,ओमित्येतदक्षरमुद्गीथमुपासीत ।  ओमिति ह्युद्गायति तस्योपव्याख्यानम् ।। 1.1.1 ।। 
Katha Upanishad,त्ँह कुमार्ँसन्तं दक्षिणासु नीयमानासु श्रद्धाविवेश सोऽमन्यत ।। 1.1.2 ।।
Mandukya Upanishad,सर्व्ँह्येतद्ब्रह्मायमात्मा ब्रह्म सोऽयमात्मा चतुष्पात् ।। 1.1.2 ।।
Aitereya Upanishad,स इमाँल्लोकानसृजत। अम्भो मरीचीर्मरमापोऽदोऽम्भः परेण दिवं द्यौः प्रतिष्ठाऽन्तरिक्षं मरीचयः। पृथिवी मरो या अधस्तात्ता आपः।।1.1.2।।
Prasna Upanishad,तान्ह स ऋषिरूवाच भूम एव तपसा ब्रह्मचर्येण श्रद्धया संवत्सरं संवत्स्यथ यथाकामं प्रश्नान्पृच्छत यदि विज्ञास्यामः सर्वं ह वो वक्ष्याम इति।।1.1.2।।
Karika Upanishad,दक्षिणाक्षिमुखे विश्वो मनस्यन्तस्तु तैजसः ।आकाशे च हृदि प्राज्ञस्त्रिधा देहे व्यवस्थितः ।। 1.1.2 ।।
Mundaka Upanishad,अथर्वणे यां प्रवदेत ब्रह्माऽथर्वा तां पुरोवाचाङ्गिरे ब्रह्मविद्याम्। स भारद्वाजाय सत्यवहाय प्राह भारद्वाजोऽङ्गिरसे परावराम्।।1.1.2।।
Isavasya Upanishad,"कुर्वन्नेवेह कर्माणि , जिजीविषेच्छतँ् समाः ।,एवं त्वयि नान्यथेतोऽस्ति न कर्म लिप्यते नरे ।। 1.1.2 ।।"
Kena Upanishad,"श्रोत्रस्य श्रोत्रं मनसो मनो यद्वाचो ह वाच्ँस उ प्राणस्य प्राणः ।,चक्षुषश्चक्षुरतिमुच्य धीराः प्रेत्यास्माल्लोकादमृता भवन्ति ।। 1.1.2 ।।"
Taittiriya Upanishad, शीक्षां व्याख्यास्यामः। वर्णः स्वरः। मात्रा बलम्। सामः संतानः। इत्युक्तः शीक्षाध्यायः।।1.2.1।।(शीक्षां पञ्च)
Svetashvatra Upanishad,"कालः स्वभावो नियतिर्यदृच्छा भूतानि योनिः पुरुष इति चिन्त्या।,संयोग एषां न त्वात्मभावादात्माप्यनीशः सुखदुःखहेतोः।।1.1.2।।"
Brihadaranyaka Upanishad,एषां भूतानां पृथिवी रसः पृथिव्या आपो रसः ।  अपामोषधयो रस ओषधीनां पुरुषो रसः पुरुषस्य वाग्रसो वाच ऋग्रस ऋचः साम रसः साम्न उद्गीथो रसः ।। 1.1.2 ।। 
Katha Upanishad,"पीतोदका जग्धतृणा दुग्धदोहा निरिन्द्रियाः ।,अनन्दा नाम ते लोकास्तान् स गच्छति ता ददत् ।। 1.1.3 ।।"
Mandukya Upanishad,जागरितस्थानो बहिष्प्रज्ञः सप्ताङ्ग एकोनविंशतिमुखः स्थूलभुग्वैश्वानरः प्रथमः पादः ।। 1.1.3 ।।
Aitereya Upanishad,स ईक्षतेमे नु लोकाः लोकपालान्नु सृजा इति। सोऽद्भ्य एव पुरूषं समुद्धृत्यामूर्च्छयत्।।1.1.3।।
Prasna Upanishad,अथ कबन्धी कात्यायन उपेत्य पप्रच्छ। भगवन्कुतो ह वा इमाः प्रजाः प्रजायन्त इति।।1.1.3।।
Karika Upanishad,विश्वो हि स्थूलभुङ् नित्यं तैजसः प्रविविक्तभुक् ।आनन्दभुक्तथा प्राज्ञस्त्रिधा भोगं निबोधत ।। 1.1.3 ।।
Mundaka Upanishad,शौनको ह वै महाशालोऽङ्गिरसं विधिवदुपसन्नः पप्रच्छ। कस्मिन्नु भगवो विज्ञाते सर्वमिदं विज्ञातं भवतीति।।1.1.3।।
Isavasya Upanishad,"असुर्या नाम ते लोका अन्धेन तमसाऽऽवृताः ।,ता्ँस्ते प्रेत्याभिगच्छन्ति ये के चात्महनो जनाः ।। 1.1.3 ।।"
Kena Upanishad,न तत्र चक्षुर्गच्छति न वाग्गच्छति नो मनो न विद्मो न विजानीमो यथैतदनुशिष्यात् ।। 1.1.3 ।। 
Taittiriya Upanishad,"सह नौ यशः। सह नौ ब्रह्मवर्चसम्। अथातः स्ँहिताया उपनिषदं व्याख्यास्यामः। पञ्चस्वधिकरणेषु। अधिलोकमधिज्यौतिषमधिविद्यमधिप्रजमध्यात्मम्। ता , महास्ँहिता , इत्याचक्षते।।1.3.1।।"
Katha Upanishad,"स होवाच पितरं तात कस्मै मां दास्यसीति ।,द्वितीयं तृतीयं त्ँहोवाच मृत्यवे त्वा ददामीति ।। 1.1.4 ।।"
Svetashvatra Upanishad,"ते ध्यानयोगानुगता अपश्यन्देवात्मशक्तिं स्वगुणैर्निगूढाम्।,यः कारणानि निखिलानि तानि कालात्मयुक्तान्यधितिष्ठत्येकः।।1.1.3।।"
Brihadaranyaka Upanishad,स एष रसानाँ् रसतमः परमः परार्ध्योऽष्टमो  यदुद्गीथः ।। 1.1.3 ।। 
Aitereya Upanishad,तमभ्यतपत्तस्याभितप्तस्य मुखं निरभिद्यत यथाऽण्डम्। मुखाद्वाग्वाचोऽग्निर्नासिके निरभिद्येतां नासिकाभ्यां प्राणः प्राणाद्वायुरक्षिणी निरभिद्येतामक्षीभ्यां चक्षुश्चक्षुष आदित्यः कर्णौ निरभिद्येतां कर्णाभ्यां श्रोत्रं श्रोत्राद्दिशस्त्वङनिरभिद्यत त्वचो लोमानि लोमभ्य ओषधि वनस्पतयो हृदयं निरभिद्यत हृदयान्मनो मनसश्चन्द्रमा नाभिर्निरभिद्यत नाभ्या अपानोऽपानान्मृत्युः शिश्नं निरभिद्यत शिश्नाद्रेतो रेतस आपः।।1.1.4।।
Prasna Upanishad,तस्मै स होवाच प्रजाकामो वै प्रजापतिः स तपोऽतप्यत स तपस्तप्त्वा स मिथुनमुत्पादयते। रयिं च प्राणं चेत्यैतौ मे बहुधा प्रजाः करिष्यत इति।।1.1.4।।
Mundaka Upanishad,तस्मै स होवाच। द्वे विद्ये वेदितव्ये इति ह स्म यद्ब्रह्मविदो वदन्ति परा चैवापरा च।।1.1.4।।
Karika Upanishad,स्थूलं तर्पयते विश्वं प्रविविक्तं तु तैजसम् ।आनन्दश्च तथा प्राज्ञं त्रिधा तृप्तिं निबोधत ।। 1.1.4 ।।
Mandukya Upanishad,स्वप्नस्थानोऽन्तःप्रज्ञः सप्ताङ्ग एकोनविंशतिमुखः प्रविविक्तभुक्तैजसो द्वितीयः पादः ।। 1.1.4 ।। 
Isavasya Upanishad,"अनेजदेकं मनसो जवीयो नैनद्देवा आप्नुवन्पूर्वमर्षत् ।,तद्धावतोऽन्यानत्येति तिष्ठत्तस्मिन्नपो मातरिश्वा दधाति ।। 1.1.4 ।।"
Kena Upanishad,अन्यदेव तद्विदितादथो अविदितादधि । इति शुश्रुम पूर्वेषां ये नस्तद्व्याचचक्षिरे ।। 1.1.4 ।।
Taittiriya Upanishad,अथाधिलोकम्। पृथिवी पूर्वरूपम्। द्यौरुत्तररूपम्। आकाशः सन्धिः। वायुः सन्धानम्। इत्यधिलोकम्।।13.2।।
Katha Upanishad,"बहूनामेमि प्रथमो बहूनामेमि मध्यमः ।,कि्ँस्विद्यमस्य कर्तव्यं यन्मयाऽद्य करिष्यति ।। 1.1.5 ।।"
Svetashvatra Upanishad,"तमेकनेमिं त्रिवृतं षोडशान्तं शतार्धारं विंशतिप्रत्यराभिः।,अष्टकैः ष़ड्भिर्विश्वरूपैकपाशं त्रिमार्गभेदं द्विनिमित्तैकमोहम्।।1.1.4।।"
Aitereya Upanishad,ता एता देवताः सृष्टा अस्मिन्महत्यर्णवे प्रापतंस्तमशनापिपासाभ्यामन्ववार्जत्। ता एनमब्रुवन्नायतनं नः प्रजानीहि यस्मिन्प्रतिष्ठिता अन्नमदामेति।।1.2.1।।
Brihadaranyaka Upanishad,कतमा कतमर्क्कतमत्कतमत्साम कतमः कतम उद्गीथ इति विमृष्टं भवति ।। 1.1.4 ।। 
Prasna Upanishad,आदित्यो ह वै प्राणो रयिरेव चन्द्रमा रयिर्वा एतत्सर्वं यन्मूर्तं चामूर्तं च तस्मान्मूर्तिरेव रयिः।।1.1.5।। 
Mundaka Upanishad,तत्रापरा ऋग्वेदो यजुर्वेदः समावेदोऽथर्ववेदः शिक्षा कल्पो व्याकरणं निरूक्तं छन्दो ज्योतिषमिति। अथ परा यया तदक्षरमधिगम्यते।।1.1.5।।
Karika Upanishad,त्रिषु धामसु यद्भोज्यं भोक्ता यश्च प्रकीर्तितः ।वेदैतदुभयं यस्तु स भुञ्जानो न लिप्यते ।। 1.1.5 ।।
Mandukya Upanishad,यत्र सुप्तो न कंचन कामं कामयते न कंचन स्वप्नं पश्यति तत्सुषुप्तम्। सुषुप्तस्थान एकीभूतः प्रज्ञानघन एवानन्दमयो ह्यानन्दभुक्चेतोमुखः प्राज्ञस्तृतीयः पादः ।। 1.1.5 ।। 
Isavasya Upanishad,"तदेजति तन्नैजति तद्दूरे तद्वन्तिके ।,तदन्तरस्य सर्वस्य तदु सर्वस्यास्य बाह्यतः ।। 1.1.5 ।।"
Kena Upanishad,"यद्वाचाऽनभ्युदितं येन वागभ्युद्यते ।,तदेव ब्रह्म त्वं विद्धि नेदं यदिदमुपासते ।। 1.1.5 ।।"
Katha Upanishad,"अनुपश्य यथा पूर्वे प्रतिपश्य तथाऽपरे ।,सस्यमिव मर्त्यः पच्यते सस्यमिवाऽऽजायते पुनः ।। 1.1.6 ।।"
Taittiriya Upanishad,अथाधिज्यौतिषम्। अग्निः पूर्वरूपम्। आदित्य उत्तररूपम् आपः सन्धिः। वैद्युतः सन्धानम्। इत्यधिज्यौतिषम्।।1.3.3।।
Svetashvatra Upanishad,"पञ्चस्रोतोम्बुं पञ्चयोन्युग्रवक्रां पञ्चप्राणोर्मिं , पञ्चबुद्धयादिमूलाम्।,पञ्चावर्तां पञ्चदुःखौघवेगां पञ्चशद्भेदां पञ्चपर्वामधीमः।।1.1.5।।"
Aitereya Upanishad,ताभ्यो गामानयत्ता अब्रुवन्न वै नोऽयमलमिति। ताभ्योऽश्वमानयत्ता अब्रुवन्न वै नोऽयमलमिति।।1.2.2।।
Brihadaranyaka Upanishad,वागेवर्क्प्राणः सामोमित्येतदक्षरमुद्गीथः ।  तद्वा एतन्मिथुनं यद्वाक्च प्राणश्चर्क्च साम च ।। 1.1.5 ।। 
Prasna Upanishad,अथादित्य उदयन्यत्प्राचीं दिशं प्रविशति तेन प्राच्यान्प्राणान्रश्मिषु संनिधत्ते। यद्दक्षिणां यत्प्रतीचीं यदुदीचीं यदधो यदूर्ध्वं यदन्तरा दिशो यत्सर्वं प्रकाशयति तेन सर्वान्प्राणान् रश्मिषु संनिधत्ते।।1.1.6।।
Mundaka Upanishad,यत्तदद्रेश्यमग्राह्यमगोत्रमवर्णमचक्षुःश्रोत्रं तदपाणिपादम्। नित्यं विभुं सर्वगतं सुसूक्ष्मं तदव्ययं यद्भूतयोनिं परिपश्यन्ति धीराः।।1.1.6।।
Mandukya Upanishad,एष सर्वेश्वर एष सर्वज्ञ एषोऽन्तर्याम्येष योनिः सर्वस्य प्रभवाप्ययौ हि भूतानाम्।। 1.1.6 ।। 
Karika Upanishad,प्रभवः सर्वभावानां सतामिति विनिश्चयः ।सर्वं जनयति प्राणश्चेतोंशून्पुरुषः पृथक ।। 1.1.6 ।।
Isavasya Upanishad,"यस्तु सर्वाणि भूतान्यात्मन्येवानुपश्यति ।,सर्वभूतेषु चात्मानं ततो न विजुगुप्सते ।। 1.1.6 ।।"
Kena Upanishad,"यन्मनसा न मनुते येनाहुर्मनो मतम् ।,तदेव ब्रह्म त्वं विद्धि नेदं यदिदमुपासते ।। 1.1.6 ।।"
Katha Upanishad,"वैश्वानरः प्रविशत्यतिथिर्ब्राह्मणो गृहान् ।,तस्यैता्ँशान्तिं कुर्वन्ति हर वैवस्वतोदकम् ।। 1.1.7 ।।"
Taittiriya Upanishad,अथाधिविद्यम्। आचार्यः पूर्वरूपम्। अन्तेवास्युत्तररूपम्। विद्या सन्धिः। प्रवचन्ँसन्धानम्। इत्यधिविद्यम्।।1.3.4।।
Aitereya Upanishad,ताभ्यः पुरूषमानयत्ता अब्रुवन् सुकृतं बतेति पुरूषो वाव सुकृतम्। ता अब्रवीद्यथायतनं प्रविशतेति।।1.2.3।।
Svetashvatra Upanishad,"सर्वाजीवे सर्वसंस्थे बृहन्ते अस्मिन्हंसो भ्राम्यते ब्रह्मचक्रे।,पृथगात्मानं प्रेरितारं च मत्वा जुष्टस्ततस्तेनामृतत्वमेति।।1.1.6।।"
Brihadaranyaka Upanishad,"तदेतन्मिथुनमोमित्येतस्मिन्नक्षरे , स , सृज्यते   यदा वै मिथुनौ समागच्छत आपयतो वै तावन्योन्यस्य कामम् ।। 1.1.6 ।।"
Prasna Upanishad,स एष वैश्वानरो विश्वरूपः प्राणोऽग्निरुदयते। तदेतदृचाभ्युक्तम्।।1.1.7।।
Mandukya Upanishad,नान्तःप्रज्ञं न बहिष्प्रज्ञं नोभयतःप्रज्ञं न प्रज्ञानघनं न प्रज्ञं नाप्रज्ञम्। अदृष्टमव्यवहार्यमग्राह्यमलक्षणमचिन्त्यमव्यपदेश्यमेकात्मप्रत्ययसारं प्रपञ्चोपशमं शान्तं शिवमद्वैतं चतुर्थं मन्यन्ते स आत्मा स विज्ञेयः ।। 1.1.7 ।। 
Isavasya Upanishad,"यस्मिन्सर्वाणि  भूतान्यात्मैवाभूद्विजानतः ।,तत्र को मोहः कः शोकः एकत्वमनुपश्यतः ।। 1.1.7 ।।"
Karika Upanishad,विभूतिं प्रसवं त्वन्ये मन्यन्ते सृष्टिचिन्तकाः ।स्वप्नमायासरूपेति सृष्टिरन्यैर्विकल्पिता ।। 1.1.7 ।।
Mundaka Upanishad,यथोर्णनाभिः सृजते गृह्णते च यथा पृथिव्यामोषधयः संभवन्ति। यथा सतः पुरूषात्केशलोमानि तथाक्षरात्संभवतीह विश्वम्।।1.1.7।।
